Audio File	Transcription
enus_ruru_242.mp3	Помолчи, у меня голова и без того кругом, а у тебя привычка говорить под руку.
enus_ruru_243.mp3	Не надо говорить мне под руку.  Я сейчас занят. Не видишь?
enus_ruru_244.mp3	по натуре он типичная деловая колбаса
enus_ruru_245.mp3	танцевать не хочешь песни не поешь не веселишься деловая колбаса
enus_ruru_246.mp3	Вот человек, у которого слишком длинный язык. Он постоянно болтает и распускает слухи.
enus_ruru_247.mp3	 Маша, у тебя длинный язык, перестань болтать.
enus_ruru_248.mp3	что бы там ни говорили сторонники и противники цифровых пространств они могут спорить до хрипоты а мне чужое мнение уже не важно
enus_ruru_249.mp3	можно спорить с этим до бесконечности до хрипоты доказывать что все это выдумки что тебя создали твои родители но ведь от этого правда не изменится
